{
  "access_keys": [],
  "azure_subscriptions": [],
  "ec2_instances": [],
  "events": [],
  "gcp_projects": [
    {
      "gcp_project_id": "gcp-t7mqc",
      "project_id": "openenv-t7mqc",
      "name": "Open Environment t7mqc",
      "state": "ACTIVE",
      "create_time": "2026-09-02T08:14:51Z",
      "parent": "folders/604281937155",
      "labels": {
        "guid": "t7mqc",
        "owner": "lnakamura",
        "rhdp-env": "open-environment"
      }
    },
    {
      "gcp_project_id": "gcp-p4xnl",
      "project_id": "openenv-p4xnl",
      "name": "Open Environment p4xnl",
      "state": "DELETE_REQUESTED",
      "create_time": "2026-08-11T13:40:07Z",
      "parent": "folders/604281937155",
      "labels": {
        "guid": "p4xnl",
        "owner": "ebarros",
        "rhdp-env": "open-environment"
      }
    },
    {
      "gcp_project_id": "gcp-h2wzd",
      "project_id": "openenv-h2wzd",
      "name": "Open Environment h2wzd",
      "state": "ACTIVE",
      "create_time": "2026-09-19T10:02:33Z",
      "parent": "folders/604281937155",
      "labels": {
        "guid": "h2wzd",
        "owner": "okeane",
        "rhdp-env": "open-environment"
      }
    },
    {
      "gcp_project_id": "gcp-w3gkt",
      "project_id": "openenv-w3gkt",
      "name": "Open Environment w3gkt",
      "state": "STATE_UNSPECIFIED",
      "create_time": "2026-10-06T16:27:18Z",
      "parent": "folders/604281937155",
      "labels": {
        "guid": "w3gkt",
        "owner": "svoigt",
        "rhdp-env": "open-environment"
      }
    },
    {
      "gcp_project_id": "gcp-k9rbf",
      "project_id": "openenv-k9rbf",
      "name": "Open Environment k9rbf",
      "state": "ACTIVE",
      "create_time": "2026-09-23T07:55:40Z",
      "parent": "folders/604281937155",
      "labels": {
        "guid": "k9rbf",
        "owner": "lnakamura",
        "rhdp-env": "open-environment"
      }
    },
    {
      "gcp_project_id": "gcp-d6vjs",
      "project_id": "openenv-d6vjs",
      "name": "Open Environment d6vjs",
      "state": "DELETE_REQUESTED",
      "create_time": "2026-08-27T09:31:12Z",
      "parent": "folders/604281937155",
      "labels": {
        "guid": "d6vjs",
        "owner": "rquist",
        "rhdp-env": "open-environment"
      }
    },
    {
      "gcp_project_id": "gcp-m5yhb",
      "project_id": "openenv-m5yhb",
      "name": "Open Environment m5yhb",
      "state": "ACTIVE",
      "create_time": "2026-10-01T12:48:26Z",
      "parent": "folders/604281937155",
      "labels": {
        "guid": "m5yhb",
        "owner": "fbankole",
        "rhdp-env": "open-environment"
      }
    },
    {
      "gcp_project_id": "gcp-r8cyh",
      "project_id": "openenv-r8cyh",
      "name": "Open Environment r8cyh",
      "state": "DELETE_REQUESTED",
      "create_time": "2026-09-05T15:06:59Z",
      "parent": "folders/604281937155",
      "labels": {
        "guid": "r8cyh",
        "owner": "okeane",
        "rhdp-env": "open-environment"
      }
    },
    {
      "gcp_project_id": "gcp-b2fqz",
      "project_id": "openenv-b2fqz",
      "name": "Open Environment b2fqz",
      "state": "ACTIVE",
      "create_time": "2026-10-08T11:19:04Z",
      "parent": "folders/604281937155",
      "labels": {
        "guid": "b2fqz",
        "owner": "ebarros",
        "rhdp-env": "open-environment"
      }
    }
  ],
  "iam_users": [],
  "marketplace_agreements": [],
  "sandbox_accounts": []
}
